cat/dog,health issue,cooking time,name,save,ingredient,cook
강아지,구강개선,조리시간 30분 이내,계란 연어밥 - 강아지의 피부와 털을 위해,오늘의 레시피는 1시간도 채 걸리지 않아요. 강아지를 위해 요리에 도전해보세요,연어 20 g삶은 달걀 1 number무염버터 1 작은스푼밥 40 g오트밀 20 g김가루 15 g,먼저 연어를 씻고 사진처럼 얇게 썰어주세요.삶은 달걀은 작은 조각으로 썰어주세요뜨거운 프라이팬에 버터를 넣고 녹을 때까지 가열하세요(2-3분 정도 걸려요)그다음 팬에 얇게 썬 연어와 달걀을 넣어주고 볶아주세요.오트밀을 넣고 잘 섞어주세요.마지막으로 팬에 김가루를 넣고 5-7분간 볶아주세요.그릇에 담긴 밥 옆에 볶은 재료를 옮겨 담아주세요.
강아지,다이어트,조리시간 30분 이내,"토마토, 치즈 닭고기 수프 - 강아지 체중 감량에 효과적인","수의사를 찾아가서 강아지가 닭고기에 알레르기가 있는지 소화장애가 있는지 점검하세요. 강아지는 어떤 음식 재료든 알레르기가 있습니다.
강아지의 건강에 문제가 있거나 음식 재료에 알레르기가 있는지 반드시 확인하세요.
오늘 레시피는 강아지의 체중 조절을 위한 레시피이니 참고하시길 바랍니다",토마토1 1 number닭가슴살 30 g참기름 1 작은스푼파슬리 10 g호박 20 g치즈 2 작은스푼,"먼저 뜨거운 물에 마카로니를 넣고 10분간 삶아줍니다. 마카로니 삶는 법은 뜨거운 물에 삶아진 마카로니를 건져올린 다음 재빨리 차가운 물에 30초간 헹구세요. 마카로니의 면발이 탱탱하고 쫄깃해질 겁니다.마카로니가 삶아지는 동안 닭고기를 씻고 
 1.5~2cm 조각으로 잘라주세요.호박의 껍질을 벗기고 아래 사진처럼 잘게 썰어주세요준비한 토마토도 잘게 썰어주세요.이제 마카로니가 부드럽게 익었으면 냄비에서 건져 올려 물기를 빼주세요.닭고기를 섭씨 90도 온도에서 5분간 삶아주세요.
그다음 호박을 넣고 부드러워질 때까지 10분간 끓여주세요.냄비에 잘게 썬 토마토와 치즈를 넣은 다음 치즈가 용해될 때까지 휘저어 주세요.마지막 단계로 삶아진 마카로니를 냄비에 넣고 5분간 조리해주세요.이제, 그릇에 마카로니 수프를 옮겨 담고 다음 잘게 썬 파슬리를 뿌려주세요"
강아지,다이어트,조리시간 60분 이내,무칩 - 강아지의 소화 흡수에 효과적인 ,알다시피 무는 영양가 풍부한 뿌리채소로 산화방지제 전해질 무기질(구리 칼슘 등) 비타민(A C E K 등) 식이섬유의 훌륭한 공급원입니다. 그뿐만 아니라 비뇨기와 신장 장애를 치료하고 면역력을 향상시키며 당뇨병 혈당 수치를 조절하는데 도움을 줍니다. 칼로리와 지방이 적기 때문에 강아지의 비만 걱정을 하실 필요가 없습니다. 쫄깃한 무칩은 3주 동안 냉장고에 보관하셔도 됩니다. 길게는 4개월까지 냉동 보관 가능합니다.,무 200 g,무의 껍질을 벗기고 잔뿌리를 모두 제거해주세요. 무를 고를 때는 작거나 중간 크기의 무를 골라줍니다. 무 이파리가 단단하고 밝은 초록빛이 나는 걸 고릅니다. 반투명하고 밝은 하얀 무를 고르시되 어둡고 칙칙한 무는 피하시길 바랍니다.무를 0.5cm 두께로 얇게 썰어줍니다.유산지가 깔린 베이킹 트레이에 무 조각을 나란히 올려주세요.트레이를 350도로 예열된 오븐에 넣고 30분간 구워주세요.오븐을 끄고 무칩을 꺼내준 후 10분 동안 가만히 식혀주세요. 너무 바삭한 무칩은 강아지의 입안에 상처를 낼 수 있으니 버려주시길 바랍니다.
